{
  "$schema": "http://json-schema.org/draft-07/schema#",
  "title": "Pipeline Handoff Envelope",
  "description": "Common envelope for all inter-agent JSON state files",
  "type": "object",
  "required": ["schema_version", "pipeline_run_id", "timestamp", "stage", "status", "data"],
  "properties": {
    "schema_version": { "type": "string", "const": "1.0" },
    "pipeline_run_id": { "type": "string", "description": "Timestamp-based run ID, e.g. 2026-04-06T14-30-00" },
    "timestamp": { "type": "string", "format": "date-time" },
    "stage": { "type": "string", "enum": ["scanner", "human-review", "researcher", "reviewer", "categorizer"] },
    "status": { "type": "string", "enum": ["complete", "error", "pending-review"] },
    "data": { "type": "object" }
  },
  "additionalProperties": false
}
