{
  "schema_version": "1.0",
  "pipeline_run_id": "2026-04-06T14-30-00",
  "timestamp": "2026-04-06T14:30:00Z",
  "stage": "scanner",
  "status": "complete",
  "data": {
    "findings": [
      {
        "id": "finding-001",
        "title": "Test Finding: New Privacy Bill",
        "source": "congress.gov",
        "source_url": "https://www.congress.gov/bill/119th-congress/house-bill/1234",
        "summary": "A new federal privacy bill has been introduced.",
        "relevance": "high",
        "jurisdiction": "federal",
        "development_type": "legislation"
      }
    ]
  }
}
