{
  "schema_version": "1.0",
  "pipeline_run_id": "2026-04-06T14-30-00",
  "timestamp": "2026-04-06T14:30:00Z",
  "stage": "scanner",
  "status": "complete",
  "data": {
    "findings": [
      {
        "id": "SCAN-20260406-001",
        "title": "Iowa Enacts Comprehensive Privacy Law",
        "source": "Lexology / Smith & Jones LLP",
        "source_url": "https://www.lexology.com/library/detail.aspx?g=test-article-001",
        "summary": "The Iowa legislature passed HB 1234, a comprehensive consumer data privacy law.",
        "relevance": "high",
        "jurisdiction": "Iowa",
        "development_type": "legislation",
        "category": "privacy"
      },
      {
        "id": "SCAN-20260406-002",
        "title": "FTC Proposes New Data Broker Rules",
        "source": "FTC Press Release",
        "source_url": "https://www.ftc.gov/news-events/news/press-releases/2026/04/ftc-data-broker-rules",
        "summary": "The Federal Trade Commission issued a notice of proposed rulemaking targeting data brokers.",
        "relevance": "high",
        "jurisdiction": "Federal",
        "development_type": "regulation",
        "category": "privacy"
      },
      {
        "id": "SCAN-20260406-003",
        "title": "Colorado AI Act Implementation Timeline",
        "source": "Lexology / Covington",
        "source_url": "https://www.lexology.com/library/detail.aspx?g=test-article-004",
        "summary": "Colorado's landmark AI governance law takes effect in 2026.",
        "relevance": "medium",
        "jurisdiction": "Colorado",
        "development_type": "legislation",
        "category": "ai-law"
      }
    ],
    "source_failures": [
      {
        "source_id": "congress-privacy",
        "source_name": "Congress.gov Privacy Bills",
        "error": "Timeout after 30s"
      }
    ]
  }
}
