{
  "schema_version": "1.0",
  "pipeline_run_id": "2026-04-07T21-09-08",
  "timestamp": "2026-04-07T21:45:00Z",
  "stage": "researcher",
  "status": "complete",
  "data": {
    "finding_id": "SCAN-20260407-016",
    "report_title": "Colorado AI Act Enforcement Delayed Until June 30, 2026; Chatbot Safety Bill HB 1263 Advances",
    "report_path": "reports/ai-law/colorado-ai-act-delay-hb1263-2026-04-07.md",
    "format": "research-memo",
    "jurisdiction_tags": ["Colorado"],
    "confidence_summary": {
      "high": 3,
      "medium": 1,
      "low": 0
    },
    "sources_verified": [
      {
        "url": "https://leg.colorado.gov/bills/sb24-205",
        "title": "Colorado General Assembly -- SB 24-205",
        "verified": true,
        "notes": "Official bill page for the Colorado Artificial Intelligence Act; confirmed via search results"
      },
      {
        "url": "https://leg.colorado.gov/bills/sb25b-004",
        "title": "Colorado General Assembly -- SB 25B-004",
        "verified": true,
        "notes": "Official bill page for enforcement delay legislation; confirmed via search results"
      },
      {
        "url": "https://leg.colorado.gov/bills/HB26-1263",
        "title": "Colorado General Assembly -- HB 26-1263",
        "verified": true,
        "notes": "Official bill page for chatbot safety bill; confirmed via search results"
      },
      {
        "url": "https://www.akingump.com/en/insights/ai-law-and-regulation-tracker/colorado-postpones-implementation-of-colorado-ai-act-sb-24-205",
        "title": "Akin Gump -- Colorado Postpones Implementation of Colorado AI Act",
        "verified": true,
        "notes": "Law firm analysis of enforcement delay and original Act requirements"
      },
      {
        "url": "https://www.clarkhill.com/news-events/news/colorados-ai-law-delayed-until-june-2026-what-the-latest-setback-means-for-businesses/",
        "title": "Clark Hill -- Colorado's AI Law Delayed Until June 2026",
        "verified": true,
        "notes": "Law firm analysis confirming delay does not alter substantive requirements"
      },
      {
        "url": "https://coloradosun.com/2025/08/25/colorado-ai-law-tweak-dies/",
        "title": "Colorado Sun -- Colorado Lawmakers Abandon Special Session Effort",
        "verified": true,
        "notes": "News reporting on special session collapse and delay background"
      },
      {
        "url": "https://www.americanbar.org/groups/business_law/resources/business-law-today/2024-july/colorado-enacts-law-regulating-high-risk-artificial-intelligence-systems/",
        "title": "American Bar Association -- Colorado Enacts Law Regulating High-Risk AI Systems",
        "verified": true,
        "notes": "ABA analysis of SB 24-205 requirements"
      },
      {
        "url": "https://www.naag.org/attorney-general-journal/a-deep-dive-into-colorados-artificial-intelligence-act/",
        "title": "NAAG -- A Deep Dive into Colorado's Artificial Intelligence Act",
        "verified": true,
        "notes": "National Association of Attorneys General analysis of reasonable care standard"
      },
      {
        "url": "https://coloradonewsline.com/2026/03/27/colorado-lawmakers-advance-bill-to-regulate-ai-chatbot-platforms/",
        "title": "Colorado Newsline -- Parents Say Colorado Chatbot Bill Wouldn't Do Enough",
        "verified": true,
        "notes": "News reporting on HB 1263 committee passage and provisions"
      },
      {
        "url": "https://www.cpr.org/2026/02/26/ai-kids-prevent-suicides-bipartisan-bill/",
        "title": "CPR News -- AI Chatbots Would Have to Protect Kids Under Bipartisan Bill",
        "verified": true,
        "notes": "News reporting on HB 1263 introduction and provisions"
      },
      {
        "url": "https://www.cohousedems.com/news/ai-chatbot-protections-bill-passes-committee",
        "title": "Colorado House Democrats -- AI Chatbot Protections Bill Passes Committee",
        "verified": true,
        "notes": "Official press release confirming 10-3 committee vote"
      },
      {
        "url": "https://www.hunton.com/privacy-and-information-security-law/enforcement-of-colorado-ai-act-delayed-until-june-2026",
        "title": "Hunton Andrews Kurth -- Enforcement of Colorado AI Act Delayed Until June 2026",
        "verified": false,
        "notes": "Original finding source URL; WebFetch was unavailable to verify page content directly"
      }
    ],
    "confidence": "high",
    "word_count": 1150
  }
}
