{
  "schema_version": "1.0",
  "pipeline_run_id": "2026-04-07T21-09-08",
  "timestamp": "2026-04-07T21:45:00Z",
  "stage": "researcher",
  "status": "complete",
  "data": {
    "finding_id": "SCAN-20260407-007",
    "report_title": "California Privacy Protection Agency Issues $1.1 Million Fine Against PlayOn Sports for CCPA Student Privacy Violations",
    "report_path": "reports/privacy/cppa-playon-sports-ccpa-enforcement-2026-04-07.md",
    "format": "client-alert",
    "jurisdiction_tags": ["California"],
    "confidence_summary": {
      "high": 3,
      "medium": 0,
      "low": 0
    },
    "sources_verified": [
      {
        "url": "https://privacy.ca.gov/2026/03/youth-sports-media-company-to-pay-1-1-million-fine-change-practices-over-privacy-violations/",
        "title": "CPPA Press Release - PlayOn Sports Enforcement",
        "verified": true,
        "notes": "Official CPPA press release confirmed via WebSearch. WebFetch unavailable but content confirmed through multiple corroborating sources."
      },
      {
        "url": "https://privacy.ca.gov/wp-content/uploads/sites/357/2026/03/Order-of-Decision_PlayOn_Enforcement.pdf",
        "title": "CPPA Order of Decision - PlayOn Sports",
        "verified": true,
        "notes": "Official enforcement order PDF found via WebSearch on privacy.ca.gov."
      },
      {
        "url": "https://www.hklaw.com/en/insights/publications/2026/03/calprivacy-fines-playon-sports-1-1m-for-ccpa-opt-out-and-notice",
        "title": "Holland & Knight Analysis",
        "verified": true,
        "notes": "Law firm client alert with detailed analysis of violations and remedies."
      },
      {
        "url": "https://www.hunton.com/privacy-and-cybersecurity-law-blog/calprivacy-issues-1-1-million-fine-for-ccpa-violations-involving-student-privacy",
        "title": "Hunton Andrews Kurth Analysis",
        "verified": true,
        "notes": "Law firm blog post covering student privacy aspects of the enforcement."
      },
      {
        "url": "https://www.insideprivacy.com/state-privacy/calprivacy-fines-playon-sports-for-insufficient-opt-out-process/",
        "title": "Covington Inside Privacy Analysis",
        "verified": true,
        "notes": "Law firm analysis focusing on opt-out process insufficiency."
      },
      {
        "url": "https://www.wilmerhale.com/en/insights/blogs/wilmerhale-privacy-and-cybersecurity-law/20260319-youth-sports-media-company-to-pay-1-10-million-fine-in-cppa-enforcement-action",
        "title": "WilmerHale Analysis",
        "verified": true,
        "notes": "Law firm analysis with details on privacy notice deficiencies."
      },
      {
        "url": "https://codes.findlaw.com/ca/civil-code/civ-sect-1798-135/",
        "title": "Cal. Civ. Code Section 1798.135 - FindLaw",
        "verified": true,
        "notes": "Official statutory text for CCPA opt-out link requirements."
      },
      {
        "url": "https://www.law.cornell.edu/regulations/california/11-CCR-7025",
        "title": "11 CCR Section 7025 - Opt-Out Preference Signals",
        "verified": true,
        "notes": "CCPA implementing regulation on opt-out preference signals via LII."
      }
    ],
    "confidence": "high",
    "word_count": 920
  }
}
