{
  "schema_version": "1.0",
  "pipeline_run_id": "2026-04-12T21-18-15",
  "timestamp": "2026-04-12T22:35:00+00:00",
  "stage": "researcher",
  "status": "complete",
  "data": {
    "finding_id": "SCAN-20260412-009",
    "title": "Ohio Man Pleads Guilty in First-Ever Conviction Under the TAKE IT DOWN Act",
    "report_path": "reports/privacy/take-it-down-act-first-conviction-2026-04-12.md",
    "verification_status": "verified",
    "sources_count": 12,
    "sources": [
      {"url": "https://www.justice.gov/usao-sdoh/pr/columbus-man-pleads-guilty-cyberstalking-exes-creating-ai-generated-obscene-material", "title": "DOJ USAO-SDOH: Columbus man pleads guilty to cyberstalking exes, creating AI-generated obscene material", "accessed": "2026-04-12", "key_facts": "Defendant James Strahler II (37, Columbus OH); guilty plea to cyberstalking, CSAM production, and digital forgeries under TAKE IT DOWN Act; USA Dominick S. Gerace II confirms first-ever TAKE IT DOWN Act conviction."},
      {"url": "https://www.congress.gov/bill/119th-congress/senate-bill/146/text", "title": "S.146 - TAKE IT DOWN Act (119th Congress)", "accessed": "2026-04-12", "key_facts": "Official statutory text of the Act."},
      {"url": "https://www.congress.gov/crs-product/LSB11314", "title": "CRS Legal Sidebar LSB11314: The TAKE IT DOWN Act", "accessed": "2026-04-12", "key_facts": "Criminal prohibitions effective immediately; platform takedown compliance by May 19, 2026; FTC enforcement."},
      {"url": "https://www.law.cornell.edu/uscode/text/47/223a", "title": "47 U.S.C. § 223a", "accessed": "2026-04-12", "key_facts": "Codified notice-and-removal obligation for covered platforms."},
      {"url": "https://www.10tv.com/article/news/local/columbus-man-first-convicted-take-it-down-act-pleads-guilty-cybercrimes/530-fff42eac-4089-49ce-847b-0597c8a8fe39", "title": "10TV - Columbus man is first convicted in nation under Take It Down Act", "accessed": "2026-04-12", "key_facts": "Confirms first-ever conviction, plea in U.S. District Court."},
      {"url": "https://spectrumnews1.com/oh/columbus/news/2026/04/08/take-it-down-act-conviction", "title": "Spectrum News 1 Ohio - Take It Down Act conviction", "accessed": "2026-04-12", "key_facts": "April 8 plea date; underlying conduct December 2024 - June 2025."},
      {"url": "https://www.nbcnews.com/tech/security/first-person-convicted-law-criminalizing-intimate-deepfakes-rcna267236", "title": "NBC News - First person convicted under law criminalizing intimate deepfakes", "accessed": "2026-04-12", "key_facts": "National confirmation; TAKE IT DOWN Act signed by Trump May 2025; three-count plea."},
      {"url": "https://en.wikipedia.org/wiki/TAKE_IT_DOWN_Act", "title": "Wikipedia - TAKE IT DOWN Act", "accessed": "2026-04-12", "key_facts": "Passage April 28, 2025; signed May 19, 2025."},
      {"url": "https://www.skadden.com/insights/publications/2025/06/take-it-down-act", "title": "Skadden - Take It Down Act platform obligations", "accessed": "2026-04-12", "key_facts": "48-hour removal; FTC enforcement framework."},
      {"url": "https://www.proskauer.com/blog/take-it-down-act-signed-into-law-offering-tools-to-fight-non-consensual-intimate-images-and-creating-a-new-image-takedown-mechanism", "title": "Proskauer Rose - Take It Down Act signed into law", "accessed": "2026-04-12", "key_facts": "Corroborates platform compliance architecture."},
      {"url": "https://www.naag.org/attorney-general-journal/congresss-attempt-to-criminalize-nonconsensual-intimate-imagery-the-benefits-and-potential-shortcomings-of-the-take-it-down-act/", "title": "NAAG - Benefits and Shortcomings of the TAKE IT DOWN Act", "accessed": "2026-04-12", "key_facts": "Anticipated First Amendment issues."},
      {"url": "https://www.dynamisllp.com/knowledge/navigating-take-it-down-act-in-litigation", "title": "Dynamis LLP - Navigating the TAKE IT DOWN Act in Litigation", "accessed": "2026-04-12", "key_facts": "Litigation outlook for contested cases."}
    ]
  }
}
