{
  "schema_version": "1.0",
  "pipeline_run_id": "2026-04-07T21-09-08",
  "timestamp": "2026-04-07T21:45:00Z",
  "stage": "researcher",
  "status": "complete",
  "data": {
    "finding_id": "SCAN-20260407-008",
    "report_title": "White House Releases National Policy Framework for AI, Urges Congress to Preempt State AI Laws",
    "report_path": "reports/ai-law/federal-white-house-ai-policy-framework-2026-04-07.md",
    "format": "client-alert",
    "jurisdiction_tags": ["Federal"],
    "confidence_summary": {
      "high": 2,
      "medium": 0,
      "low": 0
    },
    "sources_verified": [
      {
        "url": "https://www.whitehouse.gov/wp-content/uploads/2026/03/03.20.26-National-Policy-Framework-for-Artificial-Intelligence-Legislative-Recommendations.pdf",
        "title": "White House National Policy Framework for AI (PDF)",
        "verified": true,
        "notes": "Primary source document found via WebSearch; URL confirmed live"
      },
      {
        "url": "https://www.whitehouse.gov/presidential-actions/2025/12/eliminating-state-law-obstruction-of-national-artificial-intelligence-policy/",
        "title": "White House Executive Order (Dec. 11, 2025)",
        "verified": true,
        "notes": "Official White House page for the December 2025 EO; found via WebSearch"
      },
      {
        "url": "https://www.whitehouse.gov/fact-sheets/2025/12/fact-sheet-president-donald-j-trump-ensures-a-national-policy-framework-for-artificial-intelligence/",
        "title": "White House Fact Sheet on the Executive Order",
        "verified": true,
        "notes": "Official White House fact sheet; found via WebSearch"
      },
      {
        "url": "https://www.ropesgray.com/en/insights/alerts/2026/03/the-white-house-legislative-recommendations-national-policy-framework-for-artificial-intelligence-an",
        "title": "Ropes & Gray Client Alert",
        "verified": true,
        "notes": "Original finding source; confirmed via WebSearch results"
      },
      {
        "url": "https://www.crowell.com/en/insights/client-alerts/white-house-national-ai-policy-framework-calls-for-preempting-state-laws-protecting-children",
        "title": "Crowell & Moring Client Alert",
        "verified": true,
        "notes": "Found via WebSearch; corroborates preemption scope details"
      },
      {
        "url": "https://www.cooley.com/news/insight/2026/2026-03-25-white-house-releases-ai-regulatory-blueprint-what-the-national-policy-framework-means-for-companies",
        "title": "Cooley Client Alert",
        "verified": true,
        "notes": "Found via WebSearch; covers no-new-regulator and federal standards details"
      },
      {
        "url": "https://natlawreview.com/article/white-house-ai-framework-stakes-out-national-policy-position-developers-and",
        "title": "National Law Review / Proskauer Analysis",
        "verified": true,
        "notes": "Found via WebSearch; covers copyright deferral approach"
      },
      {
        "url": "https://www.kslaw.com/news-and-insights/new-state-ai-laws-are-effective-on-january-1-2026-but-a-new-executive-order-signals-disruption",
        "title": "King & Spalding Analysis",
        "verified": true,
        "notes": "Found via WebSearch; covers state AI laws effective 2026"
      },
      {
        "url": "https://www.morganlewis.com/pubs/2026/04/ai-enforcement-accelerates-as-federal-policy-stalls-and-states-step-in",
        "title": "Morgan Lewis Analysis",
        "verified": true,
        "notes": "Found via WebSearch; covers Congressional inaction on preemption"
      }
    ],
    "confidence": "high",
    "word_count": 580
  }
}
