{
  "schema_version": "1.0",
  "pipeline_run_id": "2026-04-07T21-09-08",
  "timestamp": "2026-04-08T20:03:14.382354+00:00",
  "stage": "categorizer",
  "status": "complete",
  "data": {
    "filed_reports": [
      {
        "finding_id": "SCAN-20260407-001",
        "source_path": "reports/privacy/state-comprehensive-laws/illinois-bipa-retroactive-damages-2026-04-07.md",
        "destination_path": "reports/privacy/state-comprehensive-laws/illinois-bipa-retroactive-damages-2026-04-07.md",
        "topic": "privacy",
        "subcategory": "state-comprehensive-laws",
        "is_pending": false
      },
      {
        "finding_id": "SCAN-20260407-002",
        "source_path": "reports/ai-law/washington-ai-chatbot-provenance-bills-2026-04-07.md",
        "destination_path": "reports/ai-law/washington-ai-chatbot-provenance-bills-2026-04-07.md",
        "topic": "ai-law",
        "subcategory": "",
        "is_pending": false
      },
      {
        "finding_id": "SCAN-20260407-003",
        "source_path": "reports/ai-law/oregon-ai-companion-chatbot-sb1546-2026-04-07.md",
        "destination_path": "reports/ai-law/oregon-ai-companion-chatbot-sb1546-2026-04-07.md",
        "topic": "ai-law",
        "subcategory": "",
        "is_pending": false
      },
      {
        "finding_id": "SCAN-20260407-005",
        "source_path": "reports/privacy/enforcement-actions/ftc-match-okcupid-clarifai-enforcement-2026-04-07.md",
        "destination_path": "reports/privacy/enforcement-actions/ftc-match-okcupid-clarifai-enforcement-2026-04-07.md",
        "topic": "privacy",
        "subcategory": "enforcement-actions",
        "is_pending": false
      },
      {
        "finding_id": "SCAN-20260407-006",
        "source_path": "reports/privacy/enforcement-actions/california-disney-ccpa-settlement-2026-04-07.md",
        "destination_path": "reports/privacy/enforcement-actions/california-disney-ccpa-settlement-2026-04-07.md",
        "topic": "privacy",
        "subcategory": "enforcement-actions",
        "is_pending": false
      },
      {
        "finding_id": "SCAN-20260407-007",
        "source_path": "reports/privacy/cppa-playon-sports-ccpa-enforcement-2026-04-07.md",
        "destination_path": "reports/privacy/cppa-playon-sports-ccpa-enforcement-2026-04-07.md",
        "topic": "privacy",
        "subcategory": "",
        "is_pending": false
      },
      {
        "finding_id": "SCAN-20260407-008",
        "source_path": "reports/ai-law/frameworks-guidance/federal-white-house-ai-policy-framework-2026-04-07.md",
        "destination_path": "reports/ai-law/frameworks-guidance/federal-white-house-ai-policy-framework-2026-04-07.md",
        "topic": "ai-law",
        "subcategory": "frameworks-guidance",
        "is_pending": false
      },
      {
        "finding_id": "SCAN-20260407-009",
        "source_path": "reports/privacy/kentucky-hb692-acr-sensitive-data-2026-04-07.md",
        "destination_path": "reports/privacy/kentucky-hb692-acr-sensitive-data-2026-04-07.md",
        "topic": "privacy",
        "subcategory": "",
        "is_pending": false
      },
      {
        "finding_id": "SCAN-20260407-010",
        "source_path": "reports/privacy/state-privacy-tracker-april-2026-04-07.md",
        "destination_path": "reports/privacy/state-privacy-tracker-april-2026-04-07.md",
        "topic": "privacy",
        "subcategory": "",
        "is_pending": false
      },
      {
        "finding_id": "SCAN-20260407-011",
        "source_path": "reports/cybersecurity/incident-reporting/federal-circia-final-rule-delay-2026-04-07.md",
        "destination_path": "reports/cybersecurity/incident-reporting/federal-circia-final-rule-delay-2026-04-07.md",
        "topic": "cybersecurity",
        "subcategory": "incident-reporting",
        "is_pending": false
      },
      {
        "finding_id": "SCAN-20260407-013",
        "source_path": "reports/privacy/federal-coppa-final-rule-2025-2026-04-07.md",
        "destination_path": "reports/privacy/federal-coppa-final-rule-2025-2026-04-07.md",
        "topic": "privacy",
        "subcategory": "",
        "is_pending": false
      },
      {
        "finding_id": "SCAN-20260407-015",
        "source_path": "reports/ai-law/frameworks-guidance/federal-nist-ai-agent-standards-initiative-2026-04-07.md",
        "destination_path": "reports/ai-law/frameworks-guidance/federal-nist-ai-agent-standards-initiative-2026-04-07.md",
        "topic": "ai-law",
        "subcategory": "frameworks-guidance",
        "is_pending": false
      },
      {
        "finding_id": "SCAN-20260407-016",
        "source_path": "reports/ai-law/state-legislation/colorado-ai-act-delay-hb1263-2026-04-07.md",
        "destination_path": "reports/ai-law/state-legislation/colorado-ai-act-delay-hb1263-2026-04-07.md",
        "topic": "ai-law",
        "subcategory": "state-legislation",
        "is_pending": false
      }
    ]
  }
}