{
  "schema_version": "1.0",
  "pipeline_run_id": "2026-04-07T21-09-08",
  "timestamp": "2026-04-07T21:45:00Z",
  "stage": "researcher",
  "status": "complete",
  "data": {
    "finding_id": "SCAN-20260407-015",
    "report_title": "NIST AI Agent Standards Initiative Launches Sector-Specific Listening Sessions Starting April 2026",
    "report_path": "reports/ai-law/federal-nist-ai-agent-standards-initiative-2026-04-07.md",
    "format": "research-memo",
    "jurisdiction_tags": ["Federal"],
    "confidence_summary": {
      "high": 3,
      "medium": 1,
      "low": 0
    },
    "sources_verified": [
      {
        "url": "https://www.nist.gov/news-events/news/2026/02/announcing-ai-agent-standards-initiative-interoperable-and-secure",
        "title": "NIST -- Announcing the AI Agent Standards Initiative",
        "verified": true,
        "notes": "Official NIST announcement confirmed via WebSearch results"
      },
      {
        "url": "https://www.nist.gov/caisi/ai-agent-standards-initiative",
        "title": "NIST -- AI Agent Standards Initiative Main Page",
        "verified": true,
        "notes": "Official NIST page confirmed via WebSearch results"
      },
      {
        "url": "https://www.nist.gov/news-events/news/2026/02/caisi-host-listening-sessions-barriers-ai-adoption",
        "title": "NIST -- CAISI Listening Sessions Announcement",
        "verified": true,
        "notes": "Official NIST announcement confirmed via WebSearch results"
      },
      {
        "url": "https://www.federalregister.gov/documents/2026/01/08/2026-00206/request-for-information-regarding-security-considerations-for-artificial-intelligence-agents",
        "title": "Federal Register -- RFI on AI Agent Security",
        "verified": true,
        "notes": "Official Federal Register document confirmed via WebSearch"
      },
      {
        "url": "https://csrc.nist.gov/pubs/ir/8596/iprd",
        "title": "NIST CSRC -- IR 8596 Preliminary Draft",
        "verified": true,
        "notes": "Official NIST CSRC publication page confirmed via WebSearch"
      },
      {
        "url": "https://www.pillsburylaw.com/en/news-and-insights/nist-ai-agent-standards.html",
        "title": "Pillsbury -- NIST AI Agent Standards Analysis",
        "verified": true,
        "notes": "Law firm client alert confirmed via WebSearch results"
      },
      {
        "url": "https://labs.cloudsecurityalliance.org/research/csa-research-note-nist-caisi-ai-agent-standards-federal-framework/",
        "title": "Cloud Security Alliance -- NIST CAISI Research Note",
        "verified": true,
        "notes": "CSA research note confirmed via WebSearch results"
      },
      {
        "url": "https://www.metricstream.com/blog/nists-ai-agent-standards-initiative.html",
        "title": "MetricStream -- NIST AI Agent Standards for CISOs",
        "verified": true,
        "notes": "Industry analysis confirmed via WebSearch results"
      }
    ],
    "confidence": "high",
    "word_count": 1050
  }
}