{
  "schema_version": "1.0",
  "pipeline_run_id": "2026-04-07T21-09-08",
  "timestamp": "2026-04-07T21:45:00Z",
  "stage": "researcher",
  "status": "complete",
  "data": {
    "finding_id": "SCAN-20260407-013",
    "report_title": "COPPA Final Rule Amendments Take Effect April 22, 2026 -- Biometric Data, AI Training Restrictions, and Data Retention Limits",
    "report_path": "reports/privacy/federal-coppa-final-rule-2025-2026-04-07.md",
    "format": "client-alert",
    "jurisdiction_tags": ["Federal"],
    "confidence_summary": {
      "high": 2,
      "medium": 0,
      "low": 0
    },
    "sources_verified": [
      {
        "url": "https://www.ftc.gov/news-events/news/press-releases/2025/01/ftc-finalizes-changes-childrens-privacy-rule-limiting-companies-ability-monetize-kids-data",
        "title": "FTC Press Release: FTC Finalizes Changes to Children's Privacy Rule",
        "verified": true,
        "notes": "Official FTC press release confirming 5-0 vote on January 16, 2025"
      },
      {
        "url": "https://www.federalregister.gov/documents/2025/04/22/2025-05904/childrens-online-privacy-protection-rule",
        "title": "Federal Register: Children's Online Privacy Protection Rule",
        "verified": true,
        "notes": "Official Federal Register publication, document 2025-05904"
      },
      {
        "url": "https://www.ecfr.gov/current/title-16/chapter-I/subchapter-C/part-312",
        "title": "eCFR: 16 CFR Part 312",
        "verified": true,
        "notes": "Current codified rule text on eCFR"
      },
      {
        "url": "https://www.akingump.com/en/insights/ai-law-and-regulation-tracker/new-coppa-obligations-for-ai-technologies-collecting-data-from-children",
        "title": "Akin Gump: New COPPA Obligations for AI Technologies",
        "verified": true,
        "notes": "Law firm analysis of AI training consent requirements"
      },
      {
        "url": "https://www.whitecase.com/insight-alert/unpacking-ftcs-coppa-amendments-what-you-need-know",
        "title": "White & Case: Unpacking the FTC's COPPA Amendments",
        "verified": true,
        "notes": "Comprehensive compliance guidance from major law firm"
      },
      {
        "url": "https://www.dataprotectionreport.com/2025/06/ftcs-coppa-rule-changes-include-ai-training-consent-requirement/",
        "title": "Data Protection Report: FTC's COPPA Rule Changes Include AI Training Consent Requirement",
        "verified": true,
        "notes": "Norton Rose Fulbright analysis of AI training provisions"
      },
      {
        "url": "https://www.fenwick.com/insights/publications/what-the-amended-coppa-rule-means-for-data-retention-practices",
        "title": "Fenwick: What the Amended COPPA Rule Means for Data Retention",
        "verified": true,
        "notes": "Law firm analysis of data retention requirements"
      },
      {
        "url": "https://www.loeb.com/en/insights/publications/2025/05/childrens-online-privacy-in-2025-the-amended-coppa-rule",
        "title": "Loeb & Loeb: Children's Online Privacy in 2025",
        "verified": true,
        "notes": "Analysis including ed-tech implications and FERPA interaction"
      },
      {
        "url": "https://www.ftc.gov/business-guidance/resources/complying-coppa-frequently-asked-questions",
        "title": "FTC: Complying with COPPA FAQ",
        "verified": true,
        "notes": "Official FTC compliance guidance with penalty information"
      }
    ],
    "confidence": "high",
    "word_count": 580
  }
}
