{
  "schema_version": "1.0",
  "pipeline_run_id": "2026-04-07T21-09-08",
  "timestamp": "2026-04-07T21:45:00Z",
  "stage": "researcher",
  "status": "complete",
  "data": {
    "finding_id": "SCAN-20260407-003",
    "report_title": "Oregon Enacts AI Companion Chatbot Law SB 1546 With Private Right of Action",
    "report_path": "reports/ai-law/oregon-ai-companion-chatbot-sb1546-2026-04-07.md",
    "format": "client-alert",
    "jurisdiction_tags": ["Oregon", "Washington", "California"],
    "confidence_summary": {
      "high": 2,
      "medium": 0,
      "low": 0
    },
    "sources_verified": [
      {
        "url": "https://olis.oregonlegislature.gov/liz/2026R1/Measures/Overview/SB1546",
        "title": "Oregon Legislative Information System -- SB 1546 Overview",
        "verified": true,
        "notes": "Official bill status page confirmed via search results; shows bill passed and effective January 1, 2027"
      },
      {
        "url": "https://olis.oregonlegislature.gov/liz/2026R1/Downloads/MeasureDocument/SB1546/Enrolled",
        "title": "Oregon Legislative Information System -- SB 1546 Enrolled Text",
        "verified": true,
        "notes": "Official enrolled text available via OLIS"
      },
      {
        "url": "https://www.troutmanprivacy.com/2026/03/oregon-legislature-passes-bill-regulating-consumer-facing-interactive-ai-with-private-right-of-action/",
        "title": "Troutman Pepper -- Oregon Legislature Passes Bill Regulating Consumer-Facing Interactive AI",
        "verified": true,
        "notes": "Primary source from finding; confirmed accessible via search results"
      },
      {
        "url": "https://ourtake.bakerbotts.com/post/102mmmi/oregon-sb-1546-the-first-chatbot-law-with-real-teeth",
        "title": "Baker Botts -- Oregon SB 1546: The First Chatbot Law With Real Teeth",
        "verified": true,
        "notes": "Law firm analysis confirmed via search results; details enforcement mechanism comparison"
      },
      {
        "url": "https://www.millernash.com/industry-news/oregons-new-ai-companion-law-what-you-need-to-know",
        "title": "Miller Nash LLP -- Oregon's New AI Companion Law: What You Need to Know",
        "verified": true,
        "notes": "Oregon law firm analysis; title confirms bill signed into law"
      },
      {
        "url": "https://www.transparencycoalition.ai/news/oregon-lawmakers-pass-major-chatbot-bill-in-significant-win-for-kids-and-ai-safety",
        "title": "Transparency Coalition -- Oregon Gov. Kotek Signs Chatbot Bill Into Law",
        "verified": true,
        "notes": "Advocacy group coverage; title confirms governor signing"
      },
      {
        "url": "https://fpf.org/resource/the-rest-of-the-west-oregon-and-washington-build-on-california-chatbot-law/",
        "title": "Future of Privacy Forum -- The Rest of the West",
        "verified": true,
        "notes": "Comparative analysis of CA, OR, and WA chatbot laws"
      },
      {
        "url": "https://www.transparencycoalition.ai/news/double-win-washington-gov-ferguson-signs-two-major-ai-safety-bills-into-law",
        "title": "Transparency Coalition -- Washington Gov. Ferguson Signs Two Major AI Safety Bills",
        "verified": true,
        "notes": "Confirms Washington HB 2225 signing for cross-jurisdictional context"
      }
    ],
    "confidence": "high",
    "word_count": 590
  }
}
